Name,Title,Company,Type,Industry,ICP Score,ICP Fit,Reasoning
Jessica Murillo,"COO, Technology Lifecycle Services",IBM,Speaker,"IBM's Technology Lifecycle Services (TLS) division is a massive global field service operation, perfectly aligning with the target industry criteria. The presence of the COO and several directors from operational and AI-focused departments indicates high-level stakeholder alignment and significant potential for enterprise-scale AI automation.",100,High,"IBM's Technology Lifecycle Services (TLS) division is a massive global field service operation, perfectly aligning with the target industry criteria. The presence of the COO and several directors from operational and AI-focused departments indicates high-level stakeholder alignment and significant potential for enterprise-scale AI automation."
Tanya Singh,Chief Commercial Officer,Biotronics 3D,Speaker,"Biotronics 3D is a perfect industry match and the contact is a high-authority C-level speaker. However, the company size of 50 employees is well below the target minimum of 500, which significantly lowers the overall fit score for enterprise-scale field service automation.",70,Medium,"Biotronics 3D is a perfect industry match and the contact is a high-authority C-level speaker. However, the company size of 50 employees is well below the target minimum of 500, which significantly lowers the overall fit score for enterprise-scale field service automation."
Adam Gloss,COO,Impell,Speaker,"Impell is a strong match due to its presence in a core target industry and the involvement of a C-level speaker (COO). Although the company size of 250 falls below the 500-employee threshold, the strategic alignment with field service needs and executive-level interest justifies a High fit level.",85,High,"Impell is a strong match due to its presence in a core target industry and the involvement of a C-level speaker (COO). Although the company size of 250 falls below the 500-employee threshold, the strategic alignment with field service needs and executive-level interest justifies a High fit level."
Kyle Seiter,Chief Information Officer,TridentCare,Speaker,TridentCare is a perfect ICP match as a large-scale mobile diagnostics provider representing the Field Service industry. The lead is a C-level executive (CIO) overseeing the target IT/Technology department at a company that significantly exceeds the minimum size threshold.,100,High,TridentCare is a perfect ICP match as a large-scale mobile diagnostics provider representing the Field Service industry. The lead is a C-level executive (CIO) overseeing the target IT/Technology department at a company that significantly exceeds the minimum size threshold.
Anthony S. Billups Jr.,President,PremiStar,Speaker,"PremiStar is a perfect ICP match, operating directly in core target industries like HVAC and Building Automation with a large workforce of 2,000 employees. The engagement features a high-level executive (President), fulfilling all criteria for industry, title, department, and size.",100,High,"PremiStar is a perfect ICP match, operating directly in core target industries like HVAC and Building Automation with a large workforce of 2,000 employees. The engagement features a high-level executive (President), fulfilling all criteria for industry, title, department, and size."
Showkot Hassan,Head of the Global Service,Omron Corporation,Speaker,Omron is a primary industry target with a massive enterprise footprint and a clear requirement for global service operations. The presence of the Head of Global Service as a speaker provides high-intent signals and fits the target title and department criteria perfectly.,100,High,Omron is a primary industry target with a massive enterprise footprint and a clear requirement for global service operations. The presence of the Head of Global Service as a speaker provides high-intent signals and fits the target title and department criteria perfectly.
Brad Haeberle,"Executive Vice President, Services",Siemens Smart Infrastructure,Speaker,"Siemens Smart Infrastructure perfectly aligns with all target criteria, featuring a high-level EVP in the priority Services department within a primary target industry. The company's massive enterprise scale and active presence at the event as a speaker signify a premium, high-intent lead for field service automation.",100,High,"Siemens Smart Infrastructure perfectly aligns with all target criteria, featuring a high-level EVP in the priority Services department within a primary target industry. The company's massive enterprise scale and active presence at the event as a speaker signify a premium, high-intent lead for field service automation."
Matt Van Holland,Market Service Executive - GM Service Operations,GE HealthCare,Speaker,"GE HealthCare is a perfect enterprise-scale match within a core target industry, featuring a speaker with an ideal leadership title (GM/Executive) in a target department (Service Operations). Their business model relies heavily on field service for complex medical equipment, making them a primary candidate for AI and automation solutions.",100,High,"GE HealthCare is a perfect enterprise-scale match within a core target industry, featuring a speaker with an ideal leadership title (GM/Executive) in a target department (Service Operations). Their business model relies heavily on field service for complex medical equipment, making them a primary candidate for AI and automation solutions."
Todd Brown,"SVP, Global Commercial Operations and Service",Accuray,Speaker,"Accuray is a perfect ICP match as a Medical Device manufacturer with a clear focus on complex field service for radiotherapy systems. The lead contact is a high-level SVP in a target department (Service/Operations), and the company size and speaker status meet all priority criteria.",100,High,"Accuray is a perfect ICP match as a Medical Device manufacturer with a clear focus on complex field service for radiotherapy systems. The lead contact is a high-level SVP in a target department (Service/Operations), and the company size and speaker status meet all priority criteria."
Stephen Goulbourne,"Vice President, Global Program Director, Global Service",Reiser,Speaker,"Reiser is a perfect ICP match, operating in the industrial equipment manufacturing sector with 800 employees. The presence of a Vice President from the Global Service department as a speaker indicates both high-level title alignment and direct departmental relevance for field service automation.",100,High,"Reiser is a perfect ICP match, operating in the industrial equipment manufacturing sector with 800 employees. The presence of a Vice President from the Global Service department as a speaker indicates both high-level title alignment and direct departmental relevance for field service automation."
Norman Apfelbaum,"Global VP, Worldwide Customer Service",Coherent Corporation,Speaker,"Coherent Corp is a massive global manufacturer in the industrial technology space, perfectly aligning with the target sectors. The lead is a high-ranking executive (Global VP) in a primary target department (Customer Service), and the company's size significantly exceeds the minimum requirement.",100,High,"Coherent Corp is a massive global manufacturer in the industrial technology space, perfectly aligning with the target sectors. The lead is a high-ranking executive (Global VP) in a primary target department (Customer Service), and the company's size significantly exceeds the minimum requirement."
Armin Jehle,"Vice President, Worldwide Customer Service Organization",Agilent Technologies,Speaker,"Agilent Technologies is a perfect fit, matching the target industry (Medical Devices/Manufacturing) and exceeding the size threshold with 18,000 employees. The presence of a VP-level speaker from the Worldwide Customer Service Organization aligns precisely with the target title and department criteria for field service automation.",100,High,"Agilent Technologies is a perfect fit, matching the target industry (Medical Devices/Manufacturing) and exceeding the size threshold with 18,000 employees. The presence of a VP-level speaker from the Worldwide Customer Service Organization aligns precisely with the target title and department criteria for field service automation."
Mark Johnson,"EVP, Asset Optimization",EDF Renewables North America,Speaker,"EDF Renewables is a perfect ICP fit, falling within the target Energy industry with a high-level executive (EVP) in a relevant operational department (Asset Optimization). The company size and geographic focus align exactly with the specified criteria for field service automation.",100,High,"EDF Renewables is a perfect ICP fit, falling within the target Energy industry with a high-level executive (EVP) in a relevant operational department (Asset Optimization). The company size and geographic focus align exactly with the specified criteria for field service automation."
Sasha Ilyukhin,"Senior Vice President, Global Processing Services and Services Solutions",Tetra Pak,Speaker,"Tetra Pak is a perfect ICP fit as a massive enterprise manufacturer with a dedicated services division. The presence of an SVP of Global Processing Services indicates a high-level focus on field service and aftermarket solutions, aligning exactly with the target persona and department criteria.",100,High,"Tetra Pak is a perfect ICP fit as a massive enterprise manufacturer with a dedicated services division. The presence of an SVP of Global Processing Services indicates a high-level focus on field service and aftermarket solutions, aligning exactly with the target persona and department criteria."
Yasir Sheikh,Global Head of Applications and Connected Services,Honeywell,Speaker,"Honeywell is a Tier 1 enterprise target that aligns perfectly across all ICP criteria, specifically in manufacturing, aerospace, and building automation. The presence of two high-level service and digital leaders as speakers indicates a strategic focus on service innovation, making them a prime candidate for field service AI solutions.",100,High,"Honeywell is a Tier 1 enterprise target that aligns perfectly across all ICP criteria, specifically in manufacturing, aerospace, and building automation. The presence of two high-level service and digital leaders as speakers indicates a strategic focus on service innovation, making them a prime candidate for field service AI solutions."
Emrah Ercan,"GM, Services",Honeywell,Speaker,"Honeywell is a Tier 1 enterprise target that aligns perfectly across all ICP criteria, specifically in manufacturing, aerospace, and building automation. The presence of two high-level service and digital leaders as speakers indicates a strategic focus on service innovation, making them a prime candidate for field service AI solutions.",100,High,"Honeywell is a Tier 1 enterprise target that aligns perfectly across all ICP criteria, specifically in manufacturing, aerospace, and building automation. The presence of two high-level service and digital leaders as speakers indicates a strategic focus on service innovation, making them a prime candidate for field service AI solutions."
Shawn Moore,"VP, Global Field Services",Bell Techlogix,Speaker,"Bell Techlogix is a perfect match as they operate a large-scale field service organization within the IT sector, and the lead contact is a VP-level executive specifically over Global Field Services. The company exceeds the employee threshold and the presence of a high-level speaker confirms their strategic relevance.",100,High,"Bell Techlogix is a perfect match as they operate a large-scale field service organization within the IT sector, and the lead contact is a VP-level executive specifically over Global Field Services. The company exceeds the employee threshold and the presence of a high-level speaker confirms their strategic relevance."
David Mueller,"Vice President, Global Service",Hach,Speaker,"Hach is a perfect ICP match, operating as a large-scale manufacturer of industrial analytical instruments with a significant global field service footprint. The presence of a VP of Global Service as a speaker signifies both high-level authority and a strategic focus on service operations.",100,High,"Hach is a perfect ICP match, operating as a large-scale manufacturer of industrial analytical instruments with a significant global field service footprint. The presence of a VP of Global Service as a speaker signifies both high-level authority and a strategic focus on service operations."
Baha Tevek,"Global VP, Applications",Mitsubishi Power,Speaker,"Mitsubishi Power is a major enterprise in the energy sector with a significant focus on maintenance services, aligning perfectly with industry and size criteria. The speaker is a high-ranking Global VP in the Applications/Technology department, which is a primary decision-making hub for AI and automation software.",100,High,"Mitsubishi Power is a major enterprise in the energy sector with a significant focus on maintenance services, aligning perfectly with industry and size criteria. The speaker is a high-ranking Global VP in the Applications/Technology department, which is a primary decision-making hub for AI and automation software."
Brandon Simon,Aftermarket Sales and Field Support Director,Crown Equipment Corp,Speaker,"Crown Equipment is a perfect ICP match, operating as an enterprise-scale manufacturer with a significant field service and aftermarket operation. The contact is a Director-level speaker in the Field Support department, representing the primary target persona for field service AI automation.",100,High,"Crown Equipment is a perfect ICP match, operating as an enterprise-scale manufacturer with a significant field service and aftermarket operation. The contact is a Director-level speaker in the Field Support department, representing the primary target persona for field service AI automation."
Ben Bergman,"Director, Customer Service",Crown Equipment,Speaker,"Crown Equipment is a premier fit, operating in the target manufacturing and industrial equipment sectors with a massive enterprise footprint. The presence of a Director from the Customer Service department as a speaker demonstrates perfect alignment with field service automation personas.",100,High,"Crown Equipment is a premier fit, operating in the target manufacturing and industrial equipment sectors with a massive enterprise footprint. The presence of a Director from the Customer Service department as a speaker demonstrates perfect alignment with field service automation personas."
Ewan Stewart,"President, Mechanical",Marsden Services,Speaker,Marsden Services perfectly aligns with the ICP as an enterprise-scale field service provider specializing in mechanical and building maintenance across the USA. The presence of a President-level speaker from the Mechanical division represents a high-intent executive stakeholder within a core target department.,100,High,Marsden Services perfectly aligns with the ICP as an enterprise-scale field service provider specializing in mechanical and building maintenance across the USA. The presence of a President-level speaker from the Mechanical division represents a high-intent executive stakeholder within a core target department.
Rakesh Kumar,President,Hsg Laser,Speaker,HSG Laser is a perfect industry match in manufacturing with an employee count well above the minimum threshold. The presence of the President as a speaker indicates high-level decision-making authority for field service automation across their global operations.,95,High,HSG Laser is a perfect industry match in manufacturing with an employee count well above the minimum threshold. The presence of the President as a speaker indicates high-level decision-making authority for field service automation across their global operations.
Mark Crook,"Senior Vice President, Energy Services",HomeServe,Speaker,"HomeServe is a perfect ICP match as it operates a massive enterprise field service and HVAC network, aligning with multiple target industries. The presence of a Senior Vice President in an Energy Services (Service Operations) role provides a high-level entry point within a target department.",100,High,"HomeServe is a perfect ICP match as it operates a massive enterprise field service and HVAC network, aligning with multiple target industries. The presence of a Senior Vice President in an Energy Services (Service Operations) role provides a high-level entry point within a target department."
Salvador Accardo,"SVP, Business Development",Exponential Power,Speaker,"Exponential Power is a high-fit industry match as a provider of critical field services for industrial power systems, and the contact holds a target executive title (SVP). However, the company size is below the 500-employee minimum threshold and the specific department (Business Development) is not among the primary targets.",65,Medium,"Exponential Power is a high-fit industry match as a provider of critical field services for industrial power systems, and the contact holds a target executive title (SVP). However, the company size is below the 500-employee minimum threshold and the specific department (Business Development) is not among the primary targets."
Haroon Abbu,"SVP, Digital Technology & Data Analytics",Bell And Howell,Speaker,"Bell and Howell is an ideal candidate as they operate directly in the industrial automation and field service sectors with over 1,000 employees. The speaker's role as SVP of Digital Technology and Data Analytics perfectly aligns with the target persona for adopting field service AI and automation.",100,High,"Bell and Howell is an ideal candidate as they operate directly in the industrial automation and field service sectors with over 1,000 employees. The speaker's role as SVP of Digital Technology and Data Analytics perfectly aligns with the target persona for adopting field service AI and automation."
Michelle Vaccarello,Vice President for North America Services,Diebold Nixdorf,Speaker,"Diebold Nixdorf is a perfect ICP fit as it manages a massive global field service workforce for ATM and POS maintenance, aligning with the Industrial Equipment and Field Service categories. The presence of a North American VP of Services as a speaker provides direct access to a high-level decision-maker in a target department and geography.",100,High,"Diebold Nixdorf is a perfect ICP fit as it manages a massive global field service workforce for ATM and POS maintenance, aligning with the Industrial Equipment and Field Service categories. The presence of a North American VP of Services as a speaker provides direct access to a high-level decision-maker in a target department and geography."
Greg Parker,"VP, Americas, Life Cycle Solutions",Johnson Controls,Speaker,"Johnson Controls is a premier target for field service AI, operating directly in the HVAC and Building Automation sectors with a massive enterprise scale. The presence of two VPs specifically focused on Service Operations and Life Cycle Solutions indicates a perfect alignment with the target buyer persona and department.",100,High,"Johnson Controls is a premier target for field service AI, operating directly in the HVAC and Building Automation sectors with a massive enterprise scale. The presence of two VPs specifically focused on Service Operations and Life Cycle Solutions indicates a perfect alignment with the target buyer persona and department."
Buddy Saucier,"VP, HVAC & Controls Service Operations BSNA",Johnson Controls,Speaker,"Johnson Controls is a premier target for field service AI, operating directly in the HVAC and Building Automation sectors with a massive enterprise scale. The presence of two VPs specifically focused on Service Operations and Life Cycle Solutions indicates a perfect alignment with the target buyer persona and department.",100,High,"Johnson Controls is a premier target for field service AI, operating directly in the HVAC and Building Automation sectors with a massive enterprise scale. The presence of two VPs specifically focused on Service Operations and Life Cycle Solutions indicates a perfect alignment with the target buyer persona and department."
Eleezeh Safarians,"Vice President, Americas Service & Support",Illumina,Speaker,"Illumina is a premier manufacturer of complex genomic sequencing hardware, which aligns perfectly with medical device field service needs. The presence of a VP of Service & Support at a massive enterprise scale makes this a tier-one target for automation.",100,High,"Illumina is a premier manufacturer of complex genomic sequencing hardware, which aligns perfectly with medical device field service needs. The presence of a VP of Service & Support at a massive enterprise scale makes this a tier-one target for automation."
Anne Emberson,Global Vice President Digital,Ecolab,Speaker,Ecolab is a premier fit due to its massive global field workforce and alignment with target sectors like Energy and Healthcare. The presence of VP-level speakers from both Digital and Operations departments indicates a mature buyer persona for field service AI and automation solutions.,100,High,Ecolab is a premier fit due to its massive global field workforce and alignment with target sectors like Energy and Healthcare. The presence of VP-level speakers from both Digital and Operations departments indicates a mature buyer persona for field service AI and automation solutions.
Jacob Kulzer,"Vice President, Operations, North America Pest Elimination",Ecolab,Speaker,Ecolab is a premier fit due to its massive global field workforce and alignment with target sectors like Energy and Healthcare. The presence of VP-level speakers from both Digital and Operations departments indicates a mature buyer persona for field service AI and automation solutions.,100,High,Ecolab is a premier fit due to its massive global field workforce and alignment with target sectors like Energy and Healthcare. The presence of VP-level speakers from both Digital and Operations departments indicates a mature buyer persona for field service AI and automation solutions.
Charles Hughes,"VP, Field Services",Telaid,Speaker,"Telaid is a strong match because the VP of Field Services is a speaker, indicating high-level engagement in a primary target department and industry. Although the company size of 300 is below the 500-employee threshold, the executive title and service-heavy business model align perfectly with field service automation needs.",85,High,"Telaid is a strong match because the VP of Field Services is a speaker, indicating high-level engagement in a primary target department and industry. Although the company size of 300 is below the 500-employee threshold, the executive title and service-heavy business model align perfectly with field service automation needs."
David Cardenas,"VP, Americas Field Services",NCE Atleos,Speaker,"NCR Atleos is a premier example of a field service-intensive business, managing a vast network of physical ATM hardware that requires constant maintenance and automation. The presence of a VP-level speaker specifically within the Field Services department makes this an ideal enterprise-scale prospect.",100,High,"NCR Atleos is a premier example of a field service-intensive business, managing a vast network of physical ATM hardware that requires constant maintenance and automation. The presence of a VP-level speaker specifically within the Field Services department makes this an ideal enterprise-scale prospect."
Dr. Lisa Ferlita,"VP, Service, Americas",Oxford Instruments,Speaker,"Oxford Instruments is a high-tech manufacturing firm that perfectly aligns with the target industry, and the VP of Service for the Americas provides a direct match for the target title and department. With 2,000 employees and a featured speaker at the event, they represent a prime candidate for field service automation solutions.",100,High,"Oxford Instruments is a high-tech manufacturing firm that perfectly aligns with the target industry, and the VP of Service for the Americas provides a direct match for the target title and department. With 2,000 employees and a featured speaker at the event, they represent a prime candidate for field service automation solutions."
Chris Dickerson,"VP, Service Planning & Logistics",Nokia,Speaker,Nokia is a direct industry match with a massive enterprise footprint that far exceeds the minimum size requirement. The presence of a VP-level speaker specifically in Service Planning and Logistics represents a perfect departmental and persona alignment for field service automation.,100,High,Nokia is a direct industry match with a massive enterprise footprint that far exceeds the minimum size requirement. The presence of a VP-level speaker specifically in Service Planning and Logistics represents a perfect departmental and persona alignment for field service automation.
Ira Busman,"VP, Technical Services & Solutions",Okuma America Corporation,Speaker,"Okuma America is a direct industry match with a high-level VP from a relevant technical service department speaking at the event. Although the North American affiliate size (300) falls below the 500-employee threshold, the company's role as a major service provider for CNC technology makes it a high-quality prospect for field service automation.",85,High,"Okuma America is a direct industry match with a high-level VP from a relevant technical service department speaking at the event. Although the North American affiliate size (300) falls below the 500-employee threshold, the company's role as a major service provider for CNC technology makes it a high-quality prospect for field service automation."
