Name,Title,Company,Type,Industry,ICP Score,ICP Fit,Reasoning
Rajib Bora,"VP, Field Services",Freudenberg e-Power Systems,Speaker,"Freudenberg e-Power Systems is a perfect match, operating in the target industrial manufacturing and energy sectors with a company size that meets the minimum threshold. The primary contact is a VP of Field Services who is also a conference speaker, indicating a high-authority decision-maker actively engaged in industry discourse.",100,High,"Freudenberg e-Power Systems is a perfect match, operating in the target industrial manufacturing and energy sectors with a company size that meets the minimum threshold. The primary contact is a VP of Field Services who is also a conference speaker, indicating a high-authority decision-maker actively engaged in industry discourse."
Bryan Horne,"VP, Business and IT Transformation",USIC,Speaker,"USIC is a massive enterprise in the Utilities and Field Service sectors with 12,000 employees, exceeding size requirements. The contacts hold ideal VP and Director titles within target departments (Field Service and IT), and their status as conference speakers indicates high strategic alignment and authority.",100,High,"USIC is a massive enterprise in the Utilities and Field Service sectors with 12,000 employees, exceeding size requirements. The contacts hold ideal VP and Director titles within target departments (Field Service and IT), and their status as conference speakers indicates high strategic alignment and authority."
Steven Bolton,President,LiquiServe LLC,Speaker,"LiquiServe is a perfect industry fit within field service and commercial equipment maintenance, and the President is a target decision-maker and featured speaker. The company fails to meet the minimum size requirement of 500 employees, but the high-level executive engagement and industry alignment maintain a high fit score.",85,High,"LiquiServe is a perfect industry fit within field service and commercial equipment maintenance, and the President is a target decision-maker and featured speaker. The company fails to meet the minimum size requirement of 500 employees, but the high-level executive engagement and industry alignment maintain a high fit score."
James Mylett,Chief Executive Officer,Smart Care,Speaker,"Smart Care is a perfect ICP fit as a large-scale field service provider with 2,000 employees, aligning with target industry and size requirements. The presence of the CEO (James Mylett) as a speaker provides a maximum title match and the speaker bonus.",100,High,"Smart Care is a perfect ICP fit as a large-scale field service provider with 2,000 employees, aligning with target industry and size requirements. The presence of the CEO (James Mylett) as a speaker provides a maximum title match and the speaker bonus."
Dave Elario,CEO,EMSAR,Speaker,"EMSAR is a perfect ICP match as an independent service organization (ISO) specializing in medical and mission-critical equipment maintenance. With C-level representation as speakers and a company size exceeding the 500-employee threshold, they are a primary target for field service AI and automation solutions.",100,High,"EMSAR is a perfect ICP match as an independent service organization (ISO) specializing in medical and mission-critical equipment maintenance. With C-level representation as speakers and a company size exceeding the 500-employee threshold, they are a primary target for field service AI and automation solutions."
Mark Hermes,Chief Commercial Officer,EMSAR,Speaker,"EMSAR is a perfect ICP match as an independent service organization (ISO) specializing in medical and mission-critical equipment maintenance. With C-level representation as speakers and a company size exceeding the 500-employee threshold, they are a primary target for field service AI and automation solutions.",100,High,"EMSAR is a perfect ICP match as an independent service organization (ISO) specializing in medical and mission-critical equipment maintenance. With C-level representation as speakers and a company size exceeding the 500-employee threshold, they are a primary target for field service AI and automation solutions."
Alex Sender,"Vice President & General Manager, Global Service",Smith & Nephew,Speaker,"Smith & Nephew is a perfect ICP fit, representing a large-scale enterprise in the medical technology sector with significant field service operations. The engagement of a Vice President & General Manager of Global Service as a speaker indicates high strategic value and decision-making authority in the target department.",100,High,"Smith & Nephew is a perfect ICP fit, representing a large-scale enterprise in the medical technology sector with significant field service operations. The engagement of a Vice President & General Manager of Global Service as a speaker indicates high strategic value and decision-making authority in the target department."
Stefan Jockusch,"VP, Service Digital Solutions and Analytics",KLA,Speaker,"KLA is a perfect ICP match as a large-scale industrial manufacturer with an executive speaker whose specific title (VP, Service Digital Solutions) aligns directly with field service automation. The company's size and industry focus on complex equipment maintenance make it a high-priority target for AI service solutions.",100,High,"KLA is a perfect ICP match as a large-scale industrial manufacturer with an executive speaker whose specific title (VP, Service Digital Solutions) aligns directly with field service automation. The company's size and industry focus on complex equipment maintenance make it a high-priority target for AI service solutions."
Megan Schlam,"VP, U.S. Services Execution",Schneider Electric,Speaker,"Schneider Electric is a perfect ICP match, operating in core target industries like Industrial/Building Automation and Energy with a massive enterprise footprint. The engagement from high-level VP and Director roles within Service Operations and Execution specifically aligns with the target departments and decision-maker personas.",100,High,"Schneider Electric is a perfect ICP match, operating in core target industries like Industrial/Building Automation and Energy with a massive enterprise footprint. The engagement from high-level VP and Director roles within Service Operations and Execution specifically aligns with the target departments and decision-maker personas."
Joe Lang,"VP, Service Technology",Comfort Systems USA,Speaker,"Comfort Systems USA is a perfect ICP match as a large-scale enterprise in the HVAC/MEP sector with a VP-level lead specifically focused on Service Technology. Given their massive field workforce of over 15,000 employees, they are a primary target for field service AI and automation tools.",100,High,"Comfort Systems USA is a perfect ICP match as a large-scale enterprise in the HVAC/MEP sector with a VP-level lead specifically focused on Service Technology. Given their massive field workforce of over 15,000 employees, they are a primary target for field service AI and automation tools."
Stephanie Peters,VP & General Manager,ITW Food Equipment Group,Speaker,"ITW Food Equipment Group is a Tier-1 target as a massive industrial manufacturer with a heavy reliance on field service operations (e.g., Hobart Service). The speaker holds a high-level executive title with P&L and operational responsibility, perfectly aligning with all ICP criteria.",100,High,"ITW Food Equipment Group is a Tier-1 target as a massive industrial manufacturer with a heavy reliance on field service operations (e.g., Hobart Service). The speaker holds a high-level executive title with P&L and operational responsibility, perfectly aligning with all ICP criteria."
Bruce Nelson,"VP, Strategic Initiatives",HYTEC,Speaker,"The company operates in a relevant technical field service niche and the lead holds an ideal VP title with a speaker bonus. However, the company size of 120 is substantially below the target minimum threshold of 500 employees, preventing a high-fit rating.",73,Medium,"The company operates in a relevant technical field service niche and the lead holds an ideal VP title with a speaker bonus. However, the company size of 120 is substantially below the target minimum threshold of 500 employees, preventing a high-fit rating."
David Sarazen,Customer Service Vice President,Multivac,Speaker,"Multivac is a perfect ICP match, representing a large-scale industrial manufacturer with executive leadership specifically focused on service and customer support. The presence of two high-level speakers from relevant departments indicates a strong strategic alignment and high potential for field service automation solutions.",100,High,"Multivac is a perfect ICP match, representing a large-scale industrial manufacturer with executive leadership specifically focused on service and customer support. The presence of two high-level speakers from relevant departments indicates a strong strategic alignment and high potential for field service automation solutions."
Brian Key,"Director, Service Products",Multivac,Speaker,"Multivac is a perfect ICP match, representing a large-scale industrial manufacturer with executive leadership specifically focused on service and customer support. The presence of two high-level speakers from relevant departments indicates a strong strategic alignment and high potential for field service automation solutions.",100,High,"Multivac is a perfect ICP match, representing a large-scale industrial manufacturer with executive leadership specifically focused on service and customer support. The presence of two high-level speakers from relevant departments indicates a strong strategic alignment and high potential for field service automation solutions."
Nick Cribb,President & CEO,Sam Service,Speaker,"The company is a perfect industry match within Field Service and HVAC, and the CEO's participation as a speaker provides high-value engagement potential. Although the company size of 80 is significantly below the 500-employee threshold, the title and departmental alignment are ideal for the specified profile.",85,High,"The company is a perfect industry match within Field Service and HVAC, and the CEO's participation as a speaker provides high-value engagement potential. Although the company size of 80 is significantly below the 500-employee threshold, the title and departmental alignment are ideal for the specified profile."
Ryan Wilson,"VP, Service",DSL Ltd.,Speaker,"DSL Ltd. is a strong match for the Field Service industry and geography, and the lead is a high-priority decision-maker (VP of Service) who participated as a speaker. The score is only tempered by the company size being below the 500-employee threshold specified in the ICP.",85,High,"DSL Ltd. is a strong match for the Field Service industry and geography, and the lead is a high-priority decision-maker (VP of Service) who participated as a speaker. The score is only tempered by the company size being below the 500-employee threshold specified in the ICP."
Rob Cartia,"Vice President, ProMach Business Process & Corporate Technology Leader",ProMach,Speaker,"ProMach is a major global player in industrial packaging machinery, fitting perfectly within the target Manufacturing and Industrial Equipment sectors. The speaker holds a high-level VP title in Technology and Business Process, which are primary target departments for field service automation, and the company size is well above the 500-employee minimum.",100,High,"ProMach is a major global player in industrial packaging machinery, fitting perfectly within the target Manufacturing and Industrial Equipment sectors. The speaker holds a high-level VP title in Technology and Business Process, which are primary target departments for field service automation, and the company size is well above the 500-employee minimum."
Karen Malleret,"VP, Zone Americas Service Execution",Siemens Digital Industries Automation,Speaker,"Siemens Digital Industries Automation is a premier enterprise target that perfectly matches the industry, size, and geographic criteria. With three high-level speakers in service execution and technical support, the company demonstrates deep alignment with field service automation and digital transformation needs.",100,High,"Siemens Digital Industries Automation is a premier enterprise target that perfectly matches the industry, size, and geographic criteria. With three high-level speakers in service execution and technical support, the company demonstrates deep alignment with field service automation and digital transformation needs."
Ren Rice,"Director, Tech Support US",Siemens Digital Industries Automation,Speaker,"Siemens Digital Industries Automation is a premier enterprise target that perfectly matches the industry, size, and geographic criteria. With three high-level speakers in service execution and technical support, the company demonstrates deep alignment with field service automation and digital transformation needs.",100,High,"Siemens Digital Industries Automation is a premier enterprise target that perfectly matches the industry, size, and geographic criteria. With three high-level speakers in service execution and technical support, the company demonstrates deep alignment with field service automation and digital transformation needs."
Karry Kirchner,"Director, Business Excellence US",Siemens Digital Industries Automation,Speaker,"Siemens Digital Industries Automation is a premier enterprise target that perfectly matches the industry, size, and geographic criteria. With three high-level speakers in service execution and technical support, the company demonstrates deep alignment with field service automation and digital transformation needs.",100,High,"Siemens Digital Industries Automation is a premier enterprise target that perfectly matches the industry, size, and geographic criteria. With three high-level speakers in service execution and technical support, the company demonstrates deep alignment with field service automation and digital transformation needs."
Gail Norris,Director,Siemens,Speaker,"Siemens is an ideal enterprise-scale match within the industrial automation and energy sectors. The prospect holds a target leadership title and is a speaker, indicating high influence, while the company's massive field service and infrastructure operations represent a primary use case for field service automation.",95,High,"Siemens is an ideal enterprise-scale match within the industrial automation and energy sectors. The prospect holds a target leadership title and is a speaker, indicating high influence, while the company's massive field service and infrastructure operations represent a primary use case for field service automation."
Anthony Bacak,Head of North American Instrumentation Service,ABB,Speaker,"ABB is a top-tier fit, hitting all criteria including a target enterprise size and a direct industry match in Industrial Automation. The presence of a 'Head of' speaker in a North American Service department makes this a high-priority prospect for field service AI.",100,High,"ABB is a top-tier fit, hitting all criteria including a target enterprise size and a direct industry match in Industrial Automation. The presence of a 'Head of' speaker in a North American Service department makes this a high-priority prospect for field service AI."
Edison Rocha,Head of Customer Experience and Strategy NA,JBT Marel,Speaker,"JBT Marel is an enterprise-scale industrial equipment manufacturer with a global field service footprint for its specialized machinery. The lead holds a high-level North American leadership role in Customer Experience, which is a key department for implementing service-focused AI and automation solutions.",100,High,"JBT Marel is an enterprise-scale industrial equipment manufacturer with a global field service footprint for its specialized machinery. The lead holds a high-level North American leadership role in Customer Experience, which is a key department for implementing service-focused AI and automation solutions."
Greg Fortunato,Head of Business Development,EchoStar Corporation,Speaker,"EchoStar is a major enterprise in the Telecommunications sector with massive field operations (via DISH), aligning perfectly with field service AI needs. Although 'Business Development' is not a specifically targeted department, the speaker's 'Head of' seniority and the company's scale and industry profile result in a high ICP fit.",80,High,"EchoStar is a major enterprise in the Telecommunications sector with massive field operations (via DISH), aligning perfectly with field service AI needs. Although 'Business Development' is not a specifically targeted department, the speaker's 'Head of' seniority and the company's scale and industry profile result in a high ICP fit."
Michael Spada,Head of FinTech Operations,IGT,Speaker,"IGT manufactures and maintains a global network of physical gaming and lottery terminals, placing them squarely within the Field Service and Industrial Equipment sector. The company meets the enterprise size criteria, and the lead is a high-level operations executive who was a speaker at the source event.",95,High,"IGT manufactures and maintains a global network of physical gaming and lottery terminals, placing them squarely within the Field Service and Industrial Equipment sector. The company meets the enterprise size criteria, and the lead is a high-level operations executive who was a speaker at the source event."
Steve Gearhart,"General Manager, Service",Gosiger,Speaker,"Gosiger is a near-perfect industry and persona match, represented by a General Manager of Service which aligns with target titles and departments. While the company size of 450 falls just below the 500-employee threshold, the high-level speaker presence and specific focus on factory automation and field service make it a high-quality prospect.",85,High,"Gosiger is a near-perfect industry and persona match, represented by a General Manager of Service which aligns with target titles and departments. While the company size of 450 falls just below the 500-employee threshold, the high-level speaker presence and specific focus on factory automation and field service make it a high-quality prospect."
Carlos Carnelos Jr,IBM TLS Global Strategic Transformation Leader,IBM,Speaker,"IBM's Technology Lifecycle Services (TLS) division is a massive global field service operation, perfectly aligning with the target industry criteria. The presence of the COO and several directors from operational and AI-focused departments indicates high-level stakeholder alignment and significant potential for enterprise-scale AI automation.",100,High,"IBM's Technology Lifecycle Services (TLS) division is a massive global field service operation, perfectly aligning with the target industry criteria. The presence of the COO and several directors from operational and AI-focused departments indicates high-level stakeholder alignment and significant potential for enterprise-scale AI automation."
Keila Martinez,"Director, Supply Chain Services Global Operations",IBM,Speaker,"IBM's Technology Lifecycle Services (TLS) division is a massive global field service operation, perfectly aligning with the target industry criteria. The presence of the COO and several directors from operational and AI-focused departments indicates high-level stakeholder alignment and significant potential for enterprise-scale AI automation.",100,High,"IBM's Technology Lifecycle Services (TLS) division is a massive global field service operation, perfectly aligning with the target industry criteria. The presence of the COO and several directors from operational and AI-focused departments indicates high-level stakeholder alignment and significant potential for enterprise-scale AI automation."
Naimish Rajyaguru,National Service Head,Symphony limited,Speaker,"Symphony Limited is a strong match for the HVAC manufacturing industry and the speaker holds a relevant 'Head of Service' persona. However, the fit is tempered to Medium because the company is headquartered in India and the speaker's remit is national (India-based), which falls outside the target North American geography.",70,Medium,"Symphony Limited is a strong match for the HVAC manufacturing industry and the speaker holds a relevant 'Head of Service' persona. However, the fit is tempered to Medium because the company is headquartered in India and the speaker's remit is national (India-based), which falls outside the target North American geography."
Maor Vered,Global Service Director,IMS-Services,Speaker,"IMS-Services is a near-perfect industry and department match, providing specialized field services for high-tech sectors like semiconductors and pharma. Although the company size (400) is slightly below the 500-employee minimum threshold, the presence of a Global Service Director as a speaker indicates high strategic value and executive intent.",85,High,"IMS-Services is a near-perfect industry and department match, providing specialized field services for high-tech sectors like semiconductors and pharma. Although the company size (400) is slightly below the 500-employee minimum threshold, the presence of a Global Service Director as a speaker indicates high strategic value and executive intent."
Rod Cook,"Director, NA Service Operations",Trane Technologies,Speaker,"Trane Technologies is a perfect ICP match, operating in the target HVAC and building automation industries with a massive enterprise scale of 37,000 employees. The presence of high-level speakers in Service Operations and Building Services directly aligns with the target departments and titles for field service automation.",100,High,"Trane Technologies is a perfect ICP match, operating in the target HVAC and building automation industries with a massive enterprise scale of 37,000 employees. The presence of high-level speakers in Service Operations and Building Services directly aligns with the target departments and titles for field service automation."
Carol Marriott,Building Services Portfolio Director,Trane Technologies,Speaker,"Trane Technologies is a perfect ICP match, operating in the target HVAC and building automation industries with a massive enterprise scale of 37,000 employees. The presence of high-level speakers in Service Operations and Building Services directly aligns with the target departments and titles for field service automation.",100,High,"Trane Technologies is a perfect ICP match, operating in the target HVAC and building automation industries with a massive enterprise scale of 37,000 employees. The presence of high-level speakers in Service Operations and Building Services directly aligns with the target departments and titles for field service automation."
Dave Pitchford,"Director, Service Operations",The Coca Cola Company,Speaker,The Coca Cola Company is a global manufacturing leader with significant field service needs related to its vast network of beverage dispensing and vending equipment. The presence of a Director of Service Operations as a speaker confirms high alignment with target personas and departments.,95,High,The Coca Cola Company is a global manufacturing leader with significant field service needs related to its vast network of beverage dispensing and vending equipment. The presence of a Director of Service Operations as a speaker confirms high alignment with target personas and departments.
Jennifer Dye,"Regional Director, Service Operations NA",Schneider Electric,Speaker,"Schneider Electric is a perfect ICP match, operating in core target industries like Industrial/Building Automation and Energy with a massive enterprise footprint. The engagement from high-level VP and Director roles within Service Operations and Execution specifically aligns with the target departments and decision-maker personas.",100,High,"Schneider Electric is a perfect ICP match, operating in core target industries like Industrial/Building Automation and Energy with a massive enterprise footprint. The engagement from high-level VP and Director roles within Service Operations and Execution specifically aligns with the target departments and decision-maker personas."
Lenny Cumberledge,"Director, Field Service",Gojo Industries,Speaker,"Gojo Industries is a perfect ICP fit, meeting all target criteria including industry, company size, and geographic location. The presence of a Director-level speaker specifically from the Field Service department confirms strong alignment and high intent for field service automation solutions.",100,High,"Gojo Industries is a perfect ICP fit, meeting all target criteria including industry, company size, and geographic location. The presence of a Director-level speaker specifically from the Field Service department confirms strong alignment and high intent for field service automation solutions."
Clifford Gardner,"Director, Technical Services",Fresenius Kabi,Speaker,"Fresenius Kabi is a global leader in medical technologies and infusion devices, fitting perfectly into the target Medical Devices and Healthcare Technology industries. The lead contact is a Director of Technical Services, which directly aligns with the target persona and department for field service automation solutions at an enterprise scale.",100,High,"Fresenius Kabi is a global leader in medical technologies and infusion devices, fitting perfectly into the target Medical Devices and Healthcare Technology industries. The lead contact is a Director of Technical Services, which directly aligns with the target persona and department for field service automation solutions at an enterprise scale."
